{
  "module": "rds",
  "account_id": "123456789012",
  "region": "us-east-1",
  "status": "complete",
  "timestamp": "2026-04-19T00:00:00.000Z",
  "findings": [
    {
      "resource_type": "rds_instance",
      "resource_id": "my-database",
      "arn": "arn:aws:rds:us-east-1:123456789012:db:my-database",
      "region": "us-east-1",
      "findings": []
    }
  ]
}
