{
  "module": "apigateway",
  "account_id": "123456789012",
  "region": "us-east-1",
  "status": "complete",
  "timestamp": "2026-04-19T00:00:00.000Z",
  "findings": [
    {
      "resource_type": "apigateway_rest_api",
      "resource_id": "abc1234567",
      "arn": "arn:aws:apigateway:us-east-1::/restapis/abc1234567",
      "region": "us-east-1",
      "lambda_integrations": [
        "arn:aws:lambda:us-east-1:123456789012:function:api-handler"
      ],
      "findings": []
    }
  ]
}
