{
  "module": "lambda",
  "account_id": "123456789012",
  "region": "us-east-1",
  "status": "complete",
  "timestamp": "2026-04-19T00:00:00.000Z",
  "findings": [
    {
      "resource_type": "lambda_function",
      "resource_id": "my-function",
      "arn": "arn:aws:lambda:us-east-1:123456789012:function:my-function",
      "region": "us-east-1",
      "role": "arn:aws:iam::123456789012:role/lambda-exec-role",
      "findings": []
    }
  ]
}
