{
  "module": "ec2",
  "account_id": "123456789012",
  "region": "us-east-1",
  "status": "complete",
  "timestamp": "2026-04-19T00:00:00.000Z",
  "findings": [
    {
      "resource_type": "ec2_instance",
      "resource_id": "i-0abc123def456",
      "arn": "arn:aws:ec2:us-east-1:123456789012:instance/i-0abc123def456",
      "region": "us-east-1",
      "iam_instance_profile": {
        "arn": "arn:aws:iam::123456789012:instance-profile/ec2-profile"
      },
      "findings": []
    }
  ]
}
