{
  "module": "sns",
  "account_id": "123456789012",
  "region": "us-east-1",
  "status": "complete",
  "timestamp": "2026-04-19T00:00:00.000Z",
  "findings": [
    {
      "resource_type": "sns_topic",
      "resource_id": "arn:aws:sns:us-east-1:123456789012:my-topic",
      "arn": "arn:aws:sns:us-east-1:123456789012:my-topic",
      "region": "us-east-1",
      "findings": []
    }
  ]
}
