{
  "module": "codebuild",
  "account_id": "123456789012",
  "region": "us-east-1",
  "status": "complete",
  "timestamp": "2026-04-19T00:00:00.000Z",
  "findings": [
    {
      "resource_type": "codebuild_project",
      "resource_id": "my-build-project",
      "arn": "arn:aws:codebuild:us-east-1:123456789012:project/my-build-project",
      "region": "us-east-1",
      "service_role": "arn:aws:iam::123456789012:role/codebuild-role",
      "findings": []
    }
  ]
}
