{
  "module": "bedrock",
  "account_id": "123456789012",
  "region": "us-east-1",
  "status": "complete",
  "timestamp": "2026-04-19T00:00:00.000Z",
  "findings": [
    {
      "resource_type": "bedrock_agent",
      "resource_id": "AGENTID001",
      "arn": "arn:aws:bedrock:us-east-1:123456789012:agent/AGENTID001",
      "region": "us-east-1",
      "execution_role_arn": "arn:aws:iam::123456789012:role/bedrock-agent-role",
      "findings": []
    }
  ]
}
