{
  "module": "secrets",
  "account_id": "123456789012",
  "region": "us-east-1",
  "status": "complete",
  "timestamp": "2026-04-19T00:00:00.000Z",
  "findings": [
    {
      "resource_type": "secret",
      "resource_id": "prod/myapp/api-key",
      "arn": "arn:aws:secretsmanager:us-east-1:123456789012:secret:prod/myapp/api-key-AbCdEf",
      "region": "us-east-1",
      "findings": []
    }
  ]
}
