{
  "module": "iam",
  "account_id": "123456789012",
  "region": "us-east-1",
  "status": "complete",
  "timestamp": "2026-04-19T00:00:00.000Z",
  "findings": [
    {
      "resource_type": "iam_user",
      "resource_id": "test-user",
      "arn": "arn:aws:iam::123456789012:user/test-user",
      "region": "global",
      "groups": [],
      "findings": []
    },
    {
      "resource_type": "iam_role",
      "resource_id": "test-role",
      "arn": "arn:aws:iam::123456789012:role/test-role",
      "region": "global",
      "is_service_linked": false,
      "trust_relationships": [
        {
          "principal": "lambda.amazonaws.com",
          "trust_type": "service",
          "risk": "low"
        }
      ],
      "findings": []
    },
    {
      "resource_type": "oidc_provider",
      "resource_id": "arn:aws:iam::123456789012:oidc-provider/token.actions.githubusercontent.com",
      "arn": "arn:aws:iam::123456789012:oidc-provider/token.actions.githubusercontent.com",
      "url": "token.actions.githubusercontent.com",
      "region": "global",
      "assumed_role_arns": [
        "arn:aws:iam::123456789012:role/github-actions-role"
      ],
      "trust_conditions": [
        {
          "trust_type": "federated",
          "principal": "arn:aws:iam::123456789012:oidc-provider/token.actions.githubusercontent.com"
        }
      ],
      "findings": []
    }
  ]
}
