{
  "module": "sqs",
  "account_id": "123456789012",
  "region": "us-east-1",
  "status": "complete",
  "timestamp": "2026-04-19T00:00:00.000Z",
  "findings": [
    {
      "resource_type": "sqs_queue",
      "resource_id": "https://sqs.us-east-1.amazonaws.com/123456789012/my-queue",
      "arn": "arn:aws:sqs:us-east-1:123456789012:my-queue",
      "region": "us-east-1",
      "findings": []
    }
  ]
}
