{
  "module": "kms",
  "account_id": "123456789012",
  "region": "us-east-1",
  "timestamp": "2026-04-19T00:00:00Z",
  "status": "complete",
  "findings": [
    {
      "resource_type": "kms_key",
      "resource_id": "key-abc123",
      "arn": "arn:aws:kms:us-east-1:123456789012:key/key-abc123",
      "region": "us-east-1",
      "findings": []
    }
  ]
}
